[
  {
    "id": "s2-001",
    "name": "雷神索尔",
    "alias": [],
    "series": "S2四阵营补强卡效果表",
    "cardNo": "001",
    "image": "",
    "type": "主宰",
    "subType": "",
    "faction": "阿斯加德",
    "rarity": "8血",
    "cost": null,
    "attack": null,
    "health": null,
    "tags": [],
    "effectText": "游戏开始时，可将1张<雷神之锤>加入手牌，其视为1张起始手牌。\n我方回合 当我方主宰血量不高于3时，可消耗2士气：本回合我方所有【阿斯加德】军团在登场时获得 冲锋 。\n以上效果发动后，我方主宰本局游戏无法因任何效果增加血量。",
    "flavorText": "8血",
    "faqIds": [],
    "searchText": "雷神索尔 阿斯加德 主宰 游戏开始时，可将1张<雷神之锤>加入手牌，其视为1张起始手牌。\n我方回合 当我方主宰血量不高于3时，可消耗2士气：本回合我方所有【阿斯加德】军团在登场时获得 冲锋 。\n以上效果发动后，我方主宰本局游戏无法因任何效果增加血量。",
    "source": {
      "file": "S2四阵营补强卡效果表.xlsx",
      "page": 1
    },
    "verified": false
  },
  {
    "id": "s2-002",
    "name": "雷神之锤",
    "alias": [],
    "series": "S2四阵营补强卡效果表",
    "cardNo": "002",
    "image": "",
    "type": "军团",
    "subType": "",
    "faction": "阿斯加德",
    "rarity": "限1",
    "cost": 3,
    "attack": 2000,
    "health": null,
    "tags": [],
    "effectText": "登场时 本回合可进攻对方主宰。\n阵亡时 可抽取1张牌，并弃置1张手牌。\n规则上，当我方主宰为【雷神索尔】，可使用以下效果：\n我方 回合1次 当此军团在墓地时，可将墓地3张卡牌自选顺序返回我方牌库底部：将此军团活跃登场。",
    "flavorText": "限1",
    "faqIds": [],
    "searchText": "雷神之锤 阿斯加德 军团 登场时 本回合可进攻对方主宰。\n阵亡时 可抽取1张牌，并弃置1张手牌。\n规则上，当我方主宰为【雷神索尔】，可使用以下效果：\n我方 回合1次 当此军团在墓地时，可将墓地3张卡牌自选顺序返回我方牌库底部：将此军团活跃登场。",
    "source": {
      "file": "S2四阵营补强卡效果表.xlsx",
      "page": 1
    },
    "verified": false
  },
  {
    "id": "s2-003",
    "name": "安德华拉诺特",
    "alias": [],
    "series": "S2四阵营补强卡效果表",
    "cardNo": "003",
    "image": "",
    "type": "圣物",
    "subType": "",
    "faction": "阿斯加德",
    "rarity": "限1",
    "cost": 0,
    "attack": null,
    "health": null,
    "tags": [],
    "effectText": "规则上，在游戏开始时可将此圣物从牌库置入圣物区，起始手牌数量为4张，且我方回合结束时弃置手牌，直至手牌数量不高于6张。我方无法从手牌打出圣物。\n我方 回合1次 我方主宰受到伤害时，可抽取1张牌。\n对方回合 我方主宰因对方进攻或效果受到的第一次伤害变为2。",
    "flavorText": "限1",
    "faqIds": [],
    "searchText": "安德华拉诺特 阿斯加德 圣物 规则上，在游戏开始时可将此圣物从牌库置入圣物区，起始手牌数量为4张，且我方回合结束时弃置手牌，直至手牌数量不高于6张。我方无法从手牌打出圣物。\n我方 回合1次 我方主宰受到伤害时，可抽取1张牌。\n对方回合 我方主宰因对方进攻或效果受到的第一次伤害变为2。",
    "source": {
      "file": "S2四阵营补强卡效果表.xlsx",
      "page": 1
    },
    "verified": false
  },
  {
    "id": "s2-004",
    "name": "密米尔之泉",
    "alias": [],
    "series": "S2四阵营补强卡效果表",
    "cardNo": "004",
    "image": "",
    "type": "战术",
    "subType": "",
    "faction": "阿斯加德",
    "rarity": "",
    "cost": 1,
    "attack": null,
    "health": null,
    "tags": [],
    "effectText": "<密米尔之泉>每回合只可使用1次。\n若本回合我方主宰因效果受到累计2点及更多伤害：我方主宰可增加1点血量，抽取1张牌。随后可弃置我方牌库顶部2张牌。",
    "flavorText": "",
    "faqIds": [],
    "searchText": "密米尔之泉 阿斯加德 战术 <密米尔之泉>每回合只可使用1次。\n若本回合我方主宰因效果受到累计2点及更多伤害：我方主宰可增加1点血量，抽取1张牌。随后可弃置我方牌库顶部2张牌。",
    "source": {
      "file": "S2四阵营补强卡效果表.xlsx",
      "page": 1
    },
    "verified": false
  },
  {
    "id": "s2-005",
    "name": "海拉的凝视",
    "alias": [],
    "series": "S2四阵营补强卡效果表",
    "cardNo": "005",
    "image": "",
    "type": "战术",
    "subType": "",
    "faction": "阿斯加德",
    "rarity": "",
    "cost": 2,
    "attack": null,
    "health": null,
    "tags": [],
    "effectText": "弃置我方牌库顶部1张牌：选择对方1张军团，本回合兵力-3000。",
    "flavorText": "",
    "faqIds": [],
    "searchText": "海拉的凝视 阿斯加德 战术 弃置我方牌库顶部1张牌：选择对方1张军团，本回合兵力-3000。",
    "source": {
      "file": "S2四阵营补强卡效果表.xlsx",
      "page": 1
    },
    "verified": false
  },
  {
    "id": "s2-006",
    "name": "玛格丽特一世",
    "alias": [],
    "series": "S2四阵营补强卡效果表",
    "cardNo": "006",
    "image": "",
    "type": "军团",
    "subType": "",
    "faction": "阿斯加德",
    "rarity": "",
    "cost": 3,
    "attack": 2000,
    "health": null,
    "tags": [],
    "effectText": "进攻距离+1，远程进攻无损。\n登场时 可弃置我方牌库顶部1张牌。\n我方回合 我方主宰因效果受到伤害时，可将此军团转为休整：我方主宰增加1点血量。随后本回合我方主宰血量无法因军团效果增加。",
    "flavorText": "",
    "faqIds": [],
    "searchText": "玛格丽特一世 阿斯加德 军团 进攻距离+1，远程进攻无损。\n登场时 可弃置我方牌库顶部1张牌。\n我方回合 我方主宰因效果受到伤害时，可将此军团转为休整：我方主宰增加1点血量。随后本回合我方主宰血量无法因军团效果增加。",
    "source": {
      "file": "S2四阵营补强卡效果表.xlsx",
      "page": 1
    },
    "verified": false
  },
  {
    "id": "s2-007",
    "name": "卡纽特大帝",
    "alias": [],
    "series": "S2四阵营补强卡效果表",
    "cardNo": "007",
    "image": "",
    "type": "军团",
    "subType": "",
    "faction": "阿斯加德",
    "rarity": "",
    "cost": 7,
    "attack": 6000,
    "health": null,
    "tags": [],
    "effectText": "可对我方主宰造成1点伤害：此军团登场费用-1。\n登场时 可选择我方战场或墓地最多2张非同名的【阿斯加德】军团，触发其 阵亡时 效果。",
    "flavorText": "",
    "faqIds": [],
    "searchText": "卡纽特大帝 阿斯加德 军团 可对我方主宰造成1点伤害：此军团登场费用-1。\n登场时 可选择我方战场或墓地最多2张非同名的【阿斯加德】军团，触发其 阵亡时 效果。",
    "source": {
      "file": "S2四阵营补强卡效果表.xlsx",
      "page": 1
    },
    "verified": false
  },
  {
    "id": "s2-008",
    "name": "步行者罗洛",
    "alias": [],
    "series": "S2四阵营补强卡效果表",
    "cardNo": "008",
    "image": "",
    "type": "军团",
    "subType": "",
    "faction": "阿斯加德",
    "rarity": "",
    "cost": 8,
    "attack": 8000,
    "health": null,
    "tags": [],
    "effectText": "可将墓地最多8张【阿斯加德】卡牌自选顺序返回我方牌库底部：每返回2张，此军团登场费用-1。\n『位于前排』获得 挑衅，且无法被后排支援。\n登场时 我方主宰增加1点血量。",
    "flavorText": "",
    "faqIds": [],
    "searchText": "步行者罗洛 阿斯加德 军团 可将墓地最多8张【阿斯加德】卡牌自选顺序返回我方牌库底部：每返回2张，此军团登场费用-1。\n『位于前排』获得 挑衅，且无法被后排支援。\n登场时 我方主宰增加1点血量。",
    "source": {
      "file": "S2四阵营补强卡效果表.xlsx",
      "page": 1
    },
    "verified": false
  },
  {
    "id": "s2-009",
    "name": "月读",
    "alias": [],
    "series": "S2四阵营补强卡效果表",
    "cardNo": "009",
    "image": "",
    "type": "主宰",
    "subType": "",
    "faction": "高天原",
    "rarity": "8血",
    "cost": null,
    "attack": null,
    "health": null,
    "tags": [],
    "effectText": "我方 回合1次 我方军团位移时，可消耗1士气：选择另外1张军团进行1格位移，并使其本回合费用-1。\n我方回合 当我方1张【高天原】军团从后排位移至前排时，此军团本回合进攻时兵力+1000。\n我方回合 当我方1张【高天原】军团从前排位移至后排时，将我方1张士气转为活跃。",
    "flavorText": "8血",
    "faqIds": [],
    "searchText": "月读 高天原 主宰 我方 回合1次 我方军团位移时，可消耗1士气：选择另外1张军团进行1格位移，并使其本回合费用-1。\n我方回合 当我方1张【高天原】军团从后排位移至前排时，此军团本回合进攻时兵力+1000。\n我方回合 当我方1张【高天原】军团从前排位移至后排时，将我方1张士气转为活跃。",
    "source": {
      "file": "S2四阵营补强卡效果表.xlsx",
      "page": 1
    },
    "verified": false
  },
  {
    "id": "s2-010",
    "name": "八尺琼勾玉",
    "alias": [],
    "series": "S2四阵营补强卡效果表",
    "cardNo": "010",
    "image": "",
    "type": "圣物",
    "subType": "",
    "faction": "高天原",
    "rarity": "",
    "cost": 3,
    "attack": null,
    "health": null,
    "tags": [],
    "effectText": "登场时 可查看我方牌库，选择1张【高天原】的【骑兵】军团展示并加入手牌。随后重洗牌库。\n主动休整 选择以下一项。\n·选择我方1张活跃的军团，进行1次位移。\n·选择我方1张本回合位移过的军团，本回合获得 免死。",
    "flavorText": "",
    "faqIds": [],
    "searchText": "八尺琼勾玉 高天原 圣物 登场时 可查看我方牌库，选择1张【高天原】的【骑兵】军团展示并加入手牌。随后重洗牌库。\n主动休整 选择以下一项。\n·选择我方1张活跃的军团，进行1次位移。\n·选择我方1张本回合位移过的军团，本回合获得 免死。",
    "source": {
      "file": "S2四阵营补强卡效果表.xlsx",
      "page": 1
    },
    "verified": false
  },
  {
    "id": "s2-011",
    "name": "武运在天 铠甲在前",
    "alias": [],
    "series": "S2四阵营补强卡效果表",
    "cardNo": "011",
    "image": "",
    "type": "战术",
    "subType": "",
    "faction": "高天原",
    "rarity": "",
    "cost": 1,
    "attack": null,
    "health": null,
    "tags": [],
    "effectText": "展示我方牌库顶部5张牌，选择其中1张【圣物】和1张<上杉谦信>加入手牌，其余牌自选顺序返回我方牌库底部。\n本回合我方下1张<上杉谦信>登场费用-2，并获得 冲锋。",
    "flavorText": "",
    "faqIds": [],
    "searchText": "武运在天\n铠甲在前 高天原 战术 展示我方牌库顶部5张牌，选择其中1张【圣物】和1张<上杉谦信>加入手牌，其余牌自选顺序返回我方牌库底部。\n本回合我方下1张<上杉谦信>登场费用-2，并获得 冲锋。",
    "source": {
      "file": "S2四阵营补强卡效果表.xlsx",
      "page": 1
    },
    "verified": false
  },
  {
    "id": "s2-012",
    "name": "天下布武",
    "alias": [],
    "series": "S2四阵营补强卡效果表",
    "cardNo": "012",
    "image": "",
    "type": "战术",
    "subType": "",
    "faction": "高天原",
    "rarity": "",
    "cost": 1,
    "attack": null,
    "health": null,
    "tags": [],
    "effectText": "选择以下一项。\n·选择对方1排所有军团本回合费用-2。\n·本回合我方位于前排的所有【高天原】军团进攻时兵力+1000。\n·本回合我方所有活跃的【高天原】军团可免费进行1格位移。",
    "flavorText": "",
    "faqIds": [],
    "searchText": "天下布武 高天原 战术 选择以下一项。\n·选择对方1排所有军团本回合费用-2。\n·本回合我方位于前排的所有【高天原】军团进攻时兵力+1000。\n·本回合我方所有活跃的【高天原】军团可免费进行1格位移。",
    "source": {
      "file": "S2四阵营补强卡效果表.xlsx",
      "page": 1
    },
    "verified": false
  },
  {
    "id": "s2-013",
    "name": "井伊直虎",
    "alias": [],
    "series": "S2四阵营补强卡效果表",
    "cardNo": "013",
    "image": "",
    "type": "军团",
    "subType": "",
    "faction": "高天原",
    "rarity": "",
    "cost": 5,
    "attack": 5000,
    "health": null,
    "tags": [],
    "effectText": "登场时 可弃置1张手牌：将我方1张休整的【高天原】军团转为活跃。\n阵亡时 可抽取1张牌。",
    "flavorText": "",
    "faqIds": [],
    "searchText": "井伊直虎 高天原 军团 登场时 可弃置1张手牌：将我方1张休整的【高天原】军团转为活跃。\n阵亡时 可抽取1张牌。",
    "source": {
      "file": "S2四阵营补强卡效果表.xlsx",
      "page": 1
    },
    "verified": false
  },
  {
    "id": "s2-014",
    "name": "冲田总司",
    "alias": [],
    "series": "S2四阵营补强卡效果表",
    "cardNo": "014",
    "image": "",
    "type": "军团",
    "subType": "",
    "faction": "高天原",
    "rarity": "",
    "cost": 3,
    "attack": 3000,
    "health": null,
    "tags": [],
    "effectText": "登场时 若<草薙剑>位于我方前排，此军团获得 冲锋 ，本回合兵力+1000。\n进攻时 展示牌库顶部1张牌，若其为费用不高于3的【高天原】卡牌，可无需消耗费用将其打出；否则加入手牌。",
    "flavorText": "",
    "faqIds": [],
    "searchText": "冲田总司 高天原 军团 登场时 若<草薙剑>位于我方前排，此军团获得 冲锋 ，本回合兵力+1000。\n进攻时 展示牌库顶部1张牌，若其为费用不高于3的【高天原】卡牌，可无需消耗费用将其打出；否则加入手牌。",
    "source": {
      "file": "S2四阵营补强卡效果表.xlsx",
      "page": 1
    },
    "verified": false
  },
  {
    "id": "s2-015",
    "name": "武田信玄",
    "alias": [],
    "series": "S2四阵营补强卡效果表",
    "cardNo": "015",
    "image": "",
    "type": "军团",
    "subType": "",
    "faction": "高天原",
    "rarity": "",
    "cost": 8,
    "attack": 8000,
    "health": null,
    "tags": [],
    "effectText": "我方士气无法因主宰效果转为活跃。\n登场时 可查看我方牌库，选择1张兵力不高于5000的【高天原】军团展示并加入手牌。随后重洗牌库，选择将手牌中1张<真田幸村>活跃登场，并将1张士气转为活跃。",
    "flavorText": "",
    "faqIds": [],
    "searchText": "武田信玄 高天原 军团 我方士气无法因主宰效果转为活跃。\n登场时 可查看我方牌库，选择1张兵力不高于5000的【高天原】军团展示并加入手牌。随后重洗牌库，选择将手牌中1张<真田幸村>活跃登场，并将1张士气转为活跃。",
    "source": {
      "file": "S2四阵营补强卡效果表.xlsx",
      "page": 1
    },
    "verified": false
  },
  {
    "id": "s2-016",
    "name": "奈芙蒂斯",
    "alias": [],
    "series": "S2四阵营补强卡效果表",
    "cardNo": "016",
    "image": "",